live_id,species,content,label,background
1706638111,生鲜水果,湖北大米好吃,1,该用户对湖北大米的品质表示认可，并可能有意向购买。
1706638111,生鲜水果,天水花椒上车,0,该用户想表达的含义是：询问或催促主播上架天水花椒这款商品。
1706638111,生鲜水果,"昨晚开03真准,懂得来点点关注",0,该用户想表达的含义是：昨晚的预测很准确，认可主播能力的人可以关注支持。  （结合前文弹幕的购物氛围，用户可能在暗示主播的推荐或判断靠谱，以此吸引其他观众关注，隐含对主播专业性的认可。）
1706638111,生鲜水果,武都花椒上车,0,该用户想表达的是询问或催促主播上架武都花椒的购买链接。
1706638111,生鲜水果,上燕麦,0,该用户是在催促主播尽快上架或介绍燕麦产品。
1706638111,生鲜水果,甘肃美女真多,0,该用户可能是想通过夸赞主播或当地女性来活跃气氛，试图引起主播注意或获取互动回应。
1706638111,生鲜水果,"老师拍点大米,大米",1,该用户希望主播展示或上架大米产品以供购买。
1706638111,生鲜水果,甘肃苦荞茶,1,该用户可能是在询问或提议上架甘肃苦荞茶这款产品。
1706638111,生鲜水果,刚才五黑粉再那买,1,该用户想询问之前提到的五黑粉产品在哪里购买。
1706638111,生鲜水果,大米好,1,该用户是在称赞直播中展示的大米品质优良，表达出对产品的认可和潜在购买意向。
1706638111,生鲜水果,上苦荞茶,0,该用户希望主播尽快上架苦荞茶产品进行销售。
1706638111,生鲜水果,想要那个绿壳的乌鸡蛋,1,该用户表达了对直播中提到的绿壳乌鸡蛋有明确的购买意向。
1706638111,生鲜水果,西红柿,1,该用户可能在催促主播上架或介绍西红柿产品。
1706638111,生鲜水果,牛腱子,1,该用户是在催促主播上架或介绍牛腱子这款产品。
1706638111,生鲜水果,这主播是干啥的,0,该用户可能是在疑惑主播的身份或直播内容的主旨，因为之前的弹幕大多集中在农产品和商品推荐上，而主播的角色或直播主题并未明确提及。
1706638111,生鲜水果,老师有没有大米,1,该用户是在询问主播是否会上架或展示大米产品，表达了对购买大米的兴趣。
1706638111,生鲜水果,大红袍花椒上车,0,该用户是在催促主播上架或介绍大红袍花椒这款产品。
1706638111,生鲜水果,都是年轻人么?,0,该用户可能是在询问直播间观众群体的年龄构成，以判断商品是否适合自己或是否有同龄人的购物偏好参考。
1706638111,生鲜水果,上大米,0,该用户是在催促主播尽快上架大米商品进行售卖。
1706638111,生鲜水果,我上次拍己经吃了,0,该用户想表达的含义是：我之前已经购买过这个产品并且尝试过了。
1706638111,生鲜水果,兰州拉面,1,该用户可能在询问或建议主播上架兰州拉面的产品。
1706638111,生鲜水果,香菇酱,1,该用户想表达的含义是：询问或要求主播上架香菇酱产品。
1706638111,生鲜水果,这个女的怎么卖,0,该用户可能在询问主播展示的某位女性相关产品或模特的价格，比如与“甘肃美女”相关的特产或服饰。
1706638111,生鲜水果,鸽子开价了吗,0,该用户是在询问直播中提到的商品“鸽子”是否已经开始报价或售卖。
1706638111,生鲜水果,5包!,0,该用户想表达的含义是：我要下单购买5包这个商品。
1706638111,生鲜水果,"小明,需要大米",1,该用户是在向主播询问是否有大米商品可供购买。
1706638111,生鲜水果,一包几两,1,该用户是在询问商品的包装规格或重量信息。
1706638111,生鲜水果,"上次在小明哥这买的乌鸡蛋特别新鲜,我还要买",1,该用户想表达对主播之前售卖的乌鸡蛋品质的认可，并明确表示有再次购买的意愿。
1706638111,生鲜水果,今天你没的吃,0,该用户可能在催促主播尽快上架或补货某款商品，暗示当前没有可购买的选择。
1706638111,生鲜水果,没有乡亲父老?,0,该用户可能在询问直播间观众中是否有来自农村或年纪较大的群体。
1706638111,生鲜水果,可以上次买了,0,该用户想表达的含义是：我之前买过这个产品，现在还想再次购买。
1706638111,生鲜水果,"我中奖了,谢谢",0,该用户想表达的含义是：自己在直播间的抽奖活动中获奖，对主播或商家表示感谢。
1706638111,生鲜水果,张嘴就来呀还十块,0,该用户可能是在质疑主播对产品价格的随意报价，认为其信口开河不够可信。
1706638111,生鲜水果,主播来青海吗?,0,该用户可能在询问主播是否会到青海进行直播或带货，表达了对主播未来行程的关注和潜在的购买兴趣。
1706638111,生鲜水果,花椒上车,0,该用户想表达的含义是：询问主播是否开始售卖花椒并表达购买意向。
1706638111,生鲜水果,没意见,0,该用户可能是在回应某个商品或价格提议时表示没有异议，愿意接受或跟单购买。
1706638111,生鲜水果,有意见,0,该用户想表达的含义是：对当前直播内容或产品没有异议或反对看法。
1706638111,生鲜水果,没有意见,0,该用户想表达的含义是：对当前讨论的商品或价格没有异议，表示认可或接受。
1706638111,生鲜水果,没意二,0,该用户想表达的含义是：对此没有异议或看法。
1706638111,生鲜水果,没意见!,0,该用户想表达的含义是：对当前讨论的商品或价格没有异议，表示认可或接受。
1706638111,生鲜水果,"还在直播,休息一下吧",0,该用户可能是出于关心主播的身体状况，委婉地提醒主播注意劳逸结合。
1706638111,生鲜水果,没意见[捂脸],0,该用户是在用调侃或随声附和的方式表达对当前讨论话题的轻松认同。
1706638111,生鲜水果,不能有,0,该用户想表达的含义是：对当前讨论的商品或选项表示否定或拒绝。
1706638111,生鲜水果,十块钱一斤不便宜啊,0,该用户认为当前商品的定价偏高，对价格合理性提出质疑。
1706638111,生鲜水果,给补吧,0,该用户可能在催促主播补货上架商品，表达想要购买的意愿。
1706638111,生鲜水果,10袋,0,该用户想表达的是“我要购买10袋这个产品”。
1706638111,生鲜水果,没有意见[赞][赞][赞],0,该用户想表达的含义是：对当前讨论的商品或价格表示认可和赞同。
1706638111,生鲜水果,"上大米,上大米",0,该用户急切催促主播上架大米商品，表现出强烈的购买意愿。
1706638111,生鲜水果,没有没有[赞][赞][赞],0,该用户想表达的是对当前讨论的话题或产品表示赞同和支持。
1706638111,生鲜水果,这也不便宜啊,0,该用户认为商品价格偏高，对性价比有所质疑。
1706638111,生鲜水果,有没有小黄米,1,该用户是在询问直播间是否有售卖小黄米这款商品。
1706638111,生鲜水果,之前买的补一袋,0,该用户想表达的含义是：之前购买过该产品，现在想再补购一袋。
1706638111,生鲜水果,今天再补一袋.六代,0,"该用户想表达的含义是：打算再次购买一袋之前买过的第六代产品。 （结合前文""之前买的补一袋""和产品代际信息，用户表现出明确的复购意向，且熟悉产品版本迭代情况）"
1706638111,生鲜水果,市场规律没意见,0,该用户想表达的含义是：对当前商品的价格或促销方式表示认可，没有异议。
1706638111,生鲜水果,"我没意见,因为我没有买",0,该用户想表达的含义是：我对商品没有购买意向所以不发表看法。
1706638111,生鲜水果,苦荞茶,1,该用户可能在询问或提议主播上架苦荞茶这款商品。
1706638111,生鲜水果,上次在小明哥这买的乌鸡蛋特别新鲜,1,该用户想表达的含义是：对主播之前售卖的产品质量表示满意，暗示有再次购买的意愿。
1706638111,生鲜水果,没意见!没意见,0,"该用户可能是在跟风或附和直播间其他观众对商品价格或促销活动的默认接受态度，表达一种""随大流""的妥协心理。"
1706638111,生鲜水果,木耳有吗?,1,该用户可能在询问直播间是否有售卖木耳这款产品，表现出对购买木耳的兴趣或需求。
1706638111,生鲜水果,香菇酱,1,该用户可能在询问直播间是否有香菇酱这款商品，或表达对香菇酱的购买兴趣。
1706638111,生鲜水果,没有没有没有,0,该用户可能是在对主播的某个提议或询问表示强烈否定或拒绝。
1706638111,生鲜水果,加两袋,0,该用户想表达的是希望主播在原有购买基础上再增加两袋商品的意愿。  （结合前文语境，直播间正在讨论补货、价格和购买数量，类似“10袋”“补一袋”等弹幕频繁出现，用户很可能是在回应主播的促销话术或主动要求追加购买量。）
1706638111,生鲜水果,不用送了,0,该用户想表达的含义是：不需要再继续赠送或补发商品了。
1706638111,生鲜水果,y有意见,0,该用户可能是在询问或确认其他人对商品价格或促销活动是否有不同看法。
1706638111,生鲜水果,"我要剁手!刚上来看直播,就又买东西了[捂脸]",0,该用户想表达自己原本只是随意观看直播，却因直播内容吸引而忍不住再次下单的无奈和自嘲。
1706638111,生鲜水果,"直播卖线上卖农产品对于种植者消费者,简直就是双输,只有主播利益最大化他还要打着主动的幌子!",0,该用户认为直播销售农产品的模式实际上损害了种植者和消费者的利益，只有主播从中获利，却伪装成对双方都有益的行为。
1706638111,生鲜水果,刚才五黑粉上些,0,该用户可能在催促主播补货或重新上架之前提到的“五黑粉”商品。
1706638111,生鲜水果,"有没有生姜,蒜头之类的",1,该用户是在询问直播间是否会上架生姜、蒜头等厨房常用农产品，表现出对这类商品的购买兴趣和需求。
1706638111,生鲜水果,没有意见,0,该用户想表达的含义是：对当前直播内容或产品并无特别看法或购买意愿。
1706638111,生鲜水果,别磨叽,0,该用户想表达的含义是：催促主播加快节奏，别在无关内容上浪费时间。
1706638111,生鲜水果,现在再拍一次不是更合适吗?没意见,0,该用户可能是在附和主播关于补货或促销的提议，表示赞同现在再次购买是合适的时机且没有异议。
1706638111,生鲜水果,"有,发八袋就没意见了",0,该用户想表达的含义是：如果商家能赠送八袋产品，自己就不会对购买有异议了。
1706638111,生鲜水果,为什么有意见,0,该用户可能是在质疑或反驳其他观众对直播产品的负面评价，表达自己对当前讨论的“意见”话题感到困惑或不认同。
1706638111,生鲜水果,"五包就五包吧,挺好",0,该用户表示接受当前五包的促销方案，认为这个数量安排比较合适。
1706638111,生鲜水果,那就不要卖了,0,该用户可能是在表达对主播推销方式的不满或对产品定价的抗议，暗示如果不能满足某些条件（如优惠、赠品等）就不应该继续售卖。
1706638111,生鲜水果,不卖她的,0,该用户想表达的是反对继续售卖某个特定商品或某位主播推荐的产品。
1706638111,生鲜水果,上链接,0,该用户急切催促主播尽快开放商品购买通道。
1706638111,生鲜水果,可以的,0,该用户可能是在回应主播的某个提议或优惠方案，表示认可或同意当前的商品安排。
1706638111,生鲜水果,没有意見,0,该用户想表达的含义是：对当前的产品或促销方案表示认可，没有反对的想法。
1706638111,生鲜水果,给7包也没意见,0,该用户想表达的含义是：对当前促销方案（如赠送数量）表示满意且愿意接受。
1706638111,生鲜水果,多给一袋还有什么意见,0,该用户想表达的含义是：既然已经额外赠送了一袋，其他人就不该再挑剔或抱怨了。
1706638111,生鲜水果,多一个是试吃,0,该用户是在表达“增加一份试吃装就能消除不满意见”的意思，暗示当前产品配量存在争议，通过补充试用品可以平息其他观众对数量的异议。
1706638111,生鲜水果,要黑玉米,1,该用户想表达的是希望主播上架或推荐黑色玉米这款产品。
1706638111,生鲜水果,没意见没意见!,0,该用户想表达的含义是：对当前的产品或促销方案表示认可和接受。
1706638111,生鲜水果,下午好,0,该用户可能是在打招呼或表示刚进入直播间，试图融入当前的互动氛围。
1706638111,生鲜水果,上六包,0,该用户希望主播将六包商品上架或添加到购物链接中。
1706638111,生鲜水果,"有意见,保留意见",0,该用户想表达的含义是：虽然对当前产品方案不太满意，但选择不公开反对或继续争论。
1706638111,生鲜水果,有意见的根本不买不用看,0,该用户想表达的含义是：那些对产品有不满的人本来就不会购买，所以不必在意他们的看法。
1706638111,生鲜水果,没有没有没有没有没有没有,0,该用户想表达的是坚决否认或拒绝某种提议或意见。
1706638111,生鲜水果,给六包吧,0,该用户希望主播将商品数量调整为六包并尽快上架销售。
1706638111,生鲜水果,"买过土豆,洋葱,牛肉干都很好[比心]",0,该用户想表达的含义是：之前购买的商品质量都很满意，对直播间推荐的产品表示信任和认可。
1706638111,生鲜水果,少数服从多数,0,该用户想表达的含义是：既然大多数人都同意当前的促销方案，那就按大家的意见来执行吧。
1706638111,生鲜水果,面好吃吗?,1,该用户是在询问直播中展示的面的口味如何，可能对产品产生了兴趣并考虑购买。
1706638111,生鲜水果,演的不错,0,该用户可能在用反讽的方式表达对直播内容或促销方式的不满，认为主播的推销表演过于刻意。
1706638111,生鲜水果,有意见保留,0,该用户想表达的含义是：即使有不同看法也不会公开反对，选择保持沉默。
1706638111,生鲜水果,包装升级了吗,1,该用户可能是在询问产品包装是否有改进或变化，暗示对产品本身有兴趣并关注细节优化。
1706638111,生鲜水果,直接上,0,该用户是在催促主播尽快上架商品链接，表现出强烈的购买意愿和迫不及待的心情。
1706638111,生鲜水果,以前的补上,0,该用户可能是在回应之前关于产品数量的讨论，表示愿意接受之前提到的优惠方案（如多送一包等）。
1706638111,生鲜水果,都是顾来的年轻人?,0,该用户可能在质疑直播间观众的真实性，暗示活跃互动的观众是商家雇佣的水军。
1706638111,生鲜水果,搞活动的时候可以,0,该用户想表达的含义是：等商品做促销活动时再考虑购买。
1706638111,生鲜水果,都没意见,0,该用户想表达的含义是：大家都同意目前的优惠方案或产品安排，没有反对意见。
1706638111,生鲜水果,来个定西宽粉,1,该用户希望主播上架或推荐定西宽粉这款产品。
1706638111,生鲜水果,人家是尽地主之谊啊,0,该用户可能是在调侃主播或品牌方表现得过于热情主动，暗示其行为像是为了尽到东道主的责任而刻意迎合观众。
1706638111,生鲜水果,对有意见的发四代,0,"该用户想表达的含义是：让那些有意见的人发誓支持（或认可）第四代产品/版本。  （结合前文语境，""有意见""是讨论焦点，用户可能以调侃或对抗语气回应争议，同时隐含对当前产品迭代的维护倾向。）"
1706638111,生鲜水果,买过的人已经忘记了,0,该用户想表达的含义是：之前购买过的人已经不再关注或讨论这款产品了。
1706638111,生鲜水果,没关系[赞][赞],0,该用户想表达的含义是：对当前讨论的争议或分歧表示宽容和接纳，并支持主播或商家的决定。
1706638111,生鲜水果,"没事,几块钱的事",0,该用户想表达的含义是：这点小钱无所谓，不必计较价格。
1706638111,生鲜水果,负能量,0,该用户可能是在调侃或讽刺直播间氛围过于和谐，暗示其他观众对产品问题避而不谈或盲目追捧。
1706638111,生鲜水果,是不是热干面?,1,该用户是在询问直播中展示的商品是否为热干面，可能对这款产品感兴趣或想确认品类以便决定是否购买。
1706638111,生鲜水果,可以再买啊,0,该用户可能是在回应其他观众对商品质量的正面评价，表示自己也有意愿再次购买同款产品。
1706638111,生鲜水果,没意见!可以可以!,0,该用户想表达的含义是：对当前直播推荐的产品或活动表示赞同和支持，愿意参与购买。
1706638111,生鲜水果,理解一下,0,该用户可能在委婉地催促主播加快节奏或直接进入产品介绍环节。
1706638111,生鲜水果,不要钱都行,0,该用户是在用夸张的调侃语气表达对商品的强烈喜爱和购买意愿。
1706638111,生鲜水果,人家也不容易,0,该用户想表达的含义是：体谅主播的辛苦，暗示愿意支持购买。
1706638111,生鲜水果,没有没有没有没有,0,该用户可能在快速否定或拒绝前文讨论的某个购买建议或产品问题。
1706638111,生鲜水果,定西宽粉,1,该用户可能在催促主播上架或介绍定西宽粉这款产品，表现出明确的购买意向。
1706638111,生鲜水果,没有,0,该用户可能是在回应之前关于产品缺货或未展示的讨论，表示自己目前没有购买需求或对当前商品不感兴趣。
1706638111,生鲜水果,"反正我不买,没意见",0,该用户想表达的含义是：虽然自己没有购买意愿，但对当前直播内容或产品持中立态度。
1706638111,生鲜水果,没意见上,0,该用户想表达的含义是：对当前商品或促销活动没有异议，可以接受或支持。
1706638111,生鲜水果,打有的上次都没有买的,0,该用户想表达的含义是：上次搞活动时没买到的商品这次希望有机会购买。
1706638111,生鲜水果,这也正常,0,该用户想表达的含义是：这种情况可以理解或接受（暗示对当前讨论的商品或直播内容没有异议）。
1706638111,生鲜水果,这些人竟扯犊子[捂脸],0,该用户是在嘲讽直播间里其他人讨论的内容偏离主题或不够实在，觉得他们在说些没用的废话。
1706638111,生鲜水果,再补一包,0,该用户可能是对直播中展示的商品产生了兴趣，想要追加购买一包。
1706638111,生鲜水果,加拿大包邮吗,0,该用户可能是在询问商品是否支持国际配送并免除运费，表现出对购买流程的实用关切和潜在的消费意愿。
1706638111,生鲜水果,一炮以后也要5袋,0,该用户想表达的含义是：即使这次促销活动结束后，下次也要多囤几袋。
1706638111,生鲜水果,"一袋是试吃的,上次没有试吃呀",0,该用户可能是在抱怨上次购买时没有收到试吃装，同时对本次直播提供的试吃活动表示关注或不满。
1706638111,生鲜水果,把上次一袋补上.六袋把,0,该用户想表达的意思是：上次只买了一袋，这次要补买六袋。
1706638111,生鲜水果,不平衡就在买一单[捂脸],0,该用户想表达的含义是：虽然心里觉得不太公平，但还是忍不住想下单购买。
1706638111,生鲜水果,支持我老乡,0,该用户想表达对主播或商家的地域认同感，并暗示愿意出于同乡情谊进行支持性消费。
1706638111,生鲜水果,就5袋,0,该用户可能是在对主播提出的优惠数量表示不满或觉得太少，暗示希望增加购买份量或更大力度的促销。
1706638111,生鲜水果,己下单,0,该用户想表达自己已经完成购买行为，可能是对主播推销的产品表示认可或响应了直播间的促销活动。
1706638111,生鲜水果,市场价格肯定在变化的,0,该用户可能在暗示当前直播间的定价不合理，认为商品价格应该根据市场行情灵活调整。
1706638111,生鲜水果,已后都五代,0,该用户想表达的含义是：以后每次都买五袋。
1706638111,生鲜水果,"时间不同,价钱可以不同",0,该用户可能是在质疑商品价格的波动，认为不同时间段的价格差异不太合理。
1706638111,生鲜水果,"好,上车",0,该用户想表达的是决定跟随直播间的推荐下单购买商品。
1706638111,生鲜水果,"没意见,好吃再多拍一单吧",0,该用户认为产品品质不错，打算追加购买一份以表达认可和支持。
1706638111,生鲜水果,多送一包还有意见[捂脸][捂脸],0,该用户是在调侃那些对商家额外赠送一包商品还有不满意见的人，认为这种抱怨有些无理取闹。
1706638111,生鲜水果,会不会下次6袋,0,该用户是在询问下次购买时是否能提供6袋装的选项，暗示对当前产品规格（如5袋装）不够满意或有更大批量购买的需求。
1706638111,生鲜水果,家乡便宜点正常,0,该用户认为商品在主播家乡卖得便宜是合理现象，暗示可以接受当前价格或希望获得更多优惠。
1706638111,生鲜水果,"排队的旁边都放一排桌子,后面排队拿着多累啊",0,该用户是在委婉地抱怨直播间的促销方式不够人性化，认为应该为排队等待的顾客提供更便利的购物环境。
1706638111,生鲜水果,心态放正,0,该用户想表达的含义是：让大家对价格波动保持平常心，不要过于计较。
1706638111,生鲜水果,多少克,1,该用户是在询问直播中展示的商品单份包装的具体重量规格。
1706638111,生鲜水果,以前的补上,0,该用户想表达的是：把之前没买到的产品数量这次一起下单补够。
1706638111,生鲜水果,从不从你直播间买货,0,该用户是在调侃或表达对主播的信任，暗示自己虽然嘴上说不买，但实际上还是会支持直播间下单。
1706638111,生鲜水果,有意见的今天多拍点不就好了吗,0,该用户是在建议对产品数量有意见的观众可以通过多购买一些来弥补心理落差。
1706638111,生鲜水果,"上次的,天一旭苦荞茶还有吗?",1,该用户是在询问之前购买过的同款苦荞茶是否还有库存可供再次购买。
1706638111,生鲜水果,这帅哥咋有点眼熟呢?像某个网红?,0,该用户可能是在调侃主播长相熟悉，试图通过提及网红来拉近距离或引起互动，但并未直接表现出购买意向。
1706638111,生鲜水果,"公务员带货,就应该实事求是",0,该用户是在提醒主播带货时要诚实透明，不要夸大宣传或误导消费者。
1706638111,生鲜水果,还是要抓好品控,0,该用户是在提醒主播要重视商品质量把控，以确保消费者购买体验。
1706638111,生鲜水果,陈老师还在不?,0,该用户可能在询问主播是否仍在直播间，以便确认能否继续参与当前的促销活动或商品咨询。
1706638111,生鲜水果,甘肃苦荞茶好[赞][赞],1,该用户想表达的含义是：对甘肃苦荞茶的品质表示高度认可并隐含购买意向。  （解析：结合前文弹幕中频繁出现的下单、补货、价格讨论等购物相关互动，以及表情符号[赞]的强化语气，可推断用户通过称赞产品表达消费意愿，符合直播间促销语境下的典型反馈模式。）
1706638111,生鲜水果,有面粉么,1,该用户是在询问直播间是否有面粉商品在售，可能对购买面粉产生了兴趣。
1706638111,生鲜水果,小明你天天不上班.领导不管你吗?,0,该用户可能是在调侃主播频繁直播带货而不用上班的现象，暗示对其职业状态的好奇或轻微质疑。
1706638111,生鲜水果,这是在哪里?,0,该用户可能是在询问直播中展示的商品产地或购买渠道。
1706638111,生鲜水果,"对的,甘肃本地",0,该用户是在认同或补充关于甘肃本地产品的讨论，可能表达对甘肃特产（如苦荞茶）的地域真实性或品质的认可。
1706638111,生鲜水果,甘肃本来就好,0,该用户是在认同并强调甘肃特产（如苦荞茶）的优良品质，可能带有支持家乡产品或回应前文夸赞的意图。
1706638111,生鲜水果,杂粮的挂面吗,1,该用户可能是在询问直播中展示的挂面是否为杂粮制作的，表达了对产品具体成分的关注和潜在购买兴趣。
1706638111,生鲜水果,好上车,0,该用户想表达的含义是：现在可以下单购买了。
1706638111,生鲜水果,甘肃黄芪干的有吗,1,该用户是在询问直播间是否有售卖甘肃产的黄芪干货产品。
1706638111,生鲜水果,这是我们苦水玫瑰吗[比心],1,该用户是在确认产品是否为甘肃特产的苦水玫瑰，并表达了对该产品的喜爱和认同。
1706638111,生鲜水果,这个面条能减肥吗,1,该用户可能是想询问这款面条是否具有减肥功效，以此判断是否值得购买。
1706638111,生鲜水果,咱沾光[捂脸]买了,0,该用户想表达的含义是：跟着直播间的优惠活动下单购买了商品。  （结合前文语境，直播间可能在推广甘肃特产或杂粮食品，用户用“沾光”暗示参与了直播间的促销或福利，[捂脸]则可能表达一种调侃或庆幸的情绪。）
1706638111,生鲜水果,不是5袋吗,0,该用户可能是在质疑或确认主播之前提到的商品数量与当前宣传的不一致，认为应该是5袋而非现在展示的数量。
