live_id,species,content,label,background
1706638111,生鲜水果,已拍加急,0,该用户想表达的含义是：已经下单并选择了加急配送服务。  （结合前文语境，直播间正在讨论商品购买相关话题，如“酸菜拍不了”“我下了两单”等，说明部分观众已进入实际购买阶段，而“已拍加急”是典型的成交后反馈，强调对商品的急切需求。）
1706638111,生鲜水果,小明哥收徒弟不,0,该用户可能是对主播（小明哥）的专业能力或直播风格产生兴趣，想询问是否有机会跟随学习或参与相关活动。
1706638111,生鲜水果,够全的,0,该用户想表达的含义是：觉得直播间的商品种类非常丰富齐全。
1706638111,生鲜水果,花椒好,1,该用户想表达的含义是：对直播中展示的花椒品质表示认可并可能产生购买意向。
1706638111,生鲜水果,有腊肉吗,1,该用户是在询问直播间是否有售卖腊肉产品，表达了对这类商品的潜在购买兴趣。
1706638111,生鲜水果,上次在你直播间卖的苹果跟你买的不一样,0,"该用户可能是在质疑直播间商品的品质或描述与之前购买的实际体验存在差异，暗示对商家的信任度有所动摇或希望得到解释。  （释义方向：结合前文弹幕中频繁出现的商品询问（如洪湖藕、花椒、腊肉）和购买行为（""已拍加急""""我下了两单""），可推断直播间以生鲜食品为主，用户通过对比过往购买经历表达对当前商品真实性的顾虑，属于潜在售后问题反馈而非直接购买兴趣。）"
1706638111,生鲜水果,卖花椒的姐姐颜值在线,0,该用户想表达的含义是：主播的外貌出众，这增加了自己对花椒产品的关注和好感。  （结合语境分析：当前直播间以食品销售为主，用户互动多围绕产品品质、购买意向等，而“颜值在线”的夸赞暗示用户因主播形象对直播内容产生兴趣，可能间接提升对花椒的购买意愿。）
1706638111,生鲜水果,"买过两次产品,都给直播间不一样[捂脸][捂脸][捂脸][捂脸][捂脸]",0,该用户想表达的含义是：虽然多次购买产品，但收到的货品与直播间展示的不一致，感到无奈和失望。
1706638111,生鲜水果,大米有没有,1,该用户是在询问直播间是否有大米在售。
1706638111,生鲜水果,枸杞有吗,1,该用户是在询问直播间是否有枸杞产品在售。
1706638111,生鲜水果,"家里乌鸡蛋吃完了,我要买",1,该用户是在明确表达想要补货乌鸡蛋的购买意向。
1706638111,生鲜水果,"昨晚开03真准,懂得来点点关注",0,该用户想表达的含义是：昨晚直播推荐的03号产品效果很好，认可主播选品眼光的人可以关注直播间。  （结合前文弹幕中频繁出现的购买互动、对产品的具体询问以及部分用户反馈，可推断该弹幕意在通过分享个人体验，间接为直播间引流，同时隐含对主播推荐商品的信任。）
1706638111,生鲜水果,"这是直播几个小时了,,,我都睡一觉醒了",0,该用户想表达的含义是：直播持续时间太长，自己中途休息后回来发现还在进行。
1706638111,生鲜水果,酸菜河北拍不了吗,0,该用户是在询问酸菜产品是否不支持发往河北地区。
1706638111,生鲜水果,"小明哥,尝尝花椒",1,该用户可能是对主播推荐的花椒产品产生了兴趣，想通过互动方式让主播现场试吃展示效果。
1706638111,生鲜水果,天水姜伯约,0,该用户可能在用历史人物“姜伯约”（姜维）的名字玩梗或调侃主播，表达对直播内容或主播表现的幽默评价。
1706638111,生鲜水果,"辛苦了,累死了",0,该用户想表达的含义是：对主播长时间直播的辛苦表示关心和慰问。
1706638111,生鲜水果,花椒之乡在陇南,0,该用户可能是在认可产品的产地优势，暗示对陇南花椒的品质感兴趣或表示购买意向。
1706638111,生鲜水果,小明哥收徒弟不,0,该用户可能是被主播的带货表现或产品吸引，想询问是否有机会跟随学习相关技能或加入团队。
1706638111,生鲜水果,要乌鸡蛋乌鸡蛋乌鸡蛋,1,该用户急切地表达想要购买乌鸡蛋的强烈意愿。
1706638111,生鲜水果,最好的大红袍花椒在陇南武都,0,该用户是在强调陇南武都的花椒品质优越，可能意在推荐或认可产品，同时暗示自己有购买意向或希望主播重点介绍该产地的商品。
1706638111,生鲜水果,"我买的青红花椒都是黑子,让我退掉了",0,该用户想表达的含义是：之前购买的花椒质量有问题（发黑），导致自己不得不退货。
1706638111,生鲜水果,胡椒有没有,1,该用户是在询问直播间是否有胡椒商品在售。
1706638111,生鲜水果,大红袍在甘肃陇南,0,该用户是在强调陇南地区出产的大红袍花椒品质优良，暗示对产品的认可或购买意向。
1706638111,生鲜水果,天水麻辣烫用的就是这花椒,0,该用户是在认可并强调直播所售花椒的品质，暗示其与热门的天水麻辣烫使用的是同款原料。
1706638111,生鲜水果,让说完呀,0,该用户可能因直播节奏过快或频繁打断而感到不满，希望主播能完整表达产品信息后再进行互动。
1706638111,生鲜水果,可以可以,0,该用户想表达的含义是：对主播介绍的产品或表现表示认可和赞同。
1706638111,生鲜水果,酸菜河北发不了吗?,0,该用户是在询问酸菜这款商品是否无法配送到河北地区。
1706638111,生鲜水果,都重复的吗这些人,0,该用户可能是在抱怨直播间里不断有人重复提问或刷类似的内容，显得缺乏新意或令人烦躁。
1706638111,生鲜水果,西红柿,1,该用户可能在询问直播间是否有西红柿售卖。
1706638111,生鲜水果,小明哥带的货货真价实非常好[赞],0,该用户通过称赞主播带货的品质可靠，表达了对商品的认可和潜在的购买意愿。
1706638111,生鲜水果,没介绍清楚,0,用户觉得主播对产品特点或使用方式的讲解不够详细明白。
1706638111,生鲜水果,好花椒看四川,0,该用户是在强调四川花椒的品质优越，可能意在推荐或认可直播中展示的四川产花椒。
1706638111,生鲜水果,"在明哥这买的乌鸡蛋特别新鲜,品质高[赞]",1,该用户通过分享之前购买的正面体验，既表达了对主播带货品质的认可，也暗示会继续支持购买的行为。
1706638111,生鲜水果,你卖的苹果不一样,0,该用户想表达的含义是：你售卖的苹果与其他商家的品质或特点有所不同。
1706638111,生鲜水果,"小明哥站好几个小时,辛苦了",0,该用户想表达的含义是：对主播长时间工作的体谅和关心。
1706638111,生鲜水果,酸菜河北发不了吗,0,该用户是在询问酸菜这款商品是否无法配送到河北地区。
1706638111,生鲜水果,始终要坚定为人为民,0,该用户可能在呼吁主播保持诚信经营、服务大众的初心，强调商家应当以消费者利益为重。
1706638111,生鲜水果,卖的花椒和样品一样,0,该用户想表达的含义是：确认直播间售卖的花椒品质与展示的样品一致，对产品表示认可。
1706638111,生鲜水果,胡麻油是什么,1,该用户可能是对主播提到的胡麻油产品感到陌生，想进一步了解其具体信息或用途。
1706638111,生鲜水果,有旺仔牛奶吗,1,该用户是在询问直播间是否有售卖旺仔牛奶这款产品。
1706638111,生鲜水果,蓖麻油,1,该用户可能在询问或确认直播中提到的蓖麻油产品信息，表现出对这类商品的兴趣或需求。
1706638111,生鲜水果,这整天的站着也确实累啊,0,该用户是在表达对主播长时间站立直播的关心和体谅。
1706638111,生鲜水果,是啥油没懂,1,该用户是在询问主播刚才介绍的产品（可能是某种食用油）的具体信息，表示自己没听明白或没跟上讲解。
1706638111,生鲜水果,一买刹不住车[捂脸],0,该用户想表达的含义是：在直播间购物时因商品吸引力太强而忍不住多次下单。
1706638111,生鲜水果,这个人是干嘛的,0,该用户可能是在询问当前出现在镜头中的主播或嘉宾的身份和角色，表达对直播内容或参与者背景的困惑。
1706638111,生鲜水果,胡麻月饼,0,该用户可能是在询问或确认直播中提到的“胡麻月饼”这款产品的情况，表达了对该商品的兴趣或好奇。
1706638111,生鲜水果,"北方多,不少众",0,该用户想表达的含义是：北方地区对这种商品的需求量较大，并不算小众产品。
1706638111,生鲜水果,东北也有,0,该用户可能是在回应之前关于产品地域分布的讨论，暗示当前介绍的商品在东北地区同样有售或常见。
1706638111,生鲜水果,"今天有牛肉干吗?小明哥,来回购了[比心]",1,该用户想表达的含义是：询问当前是否有牛肉干售卖，并表明自己是老顾客前来支持主播。
1706638111,生鲜水果,胡麻油怎么做的,1,该用户可能是在询问胡麻油的生产工艺或原料来源，表现出对产品本身的兴趣和进一步了解的意愿。
1706638111,生鲜水果,这也尝?,0,该用户可能是对直播中提到的某种食品（如胡麻油或花椒）的口味或品质感到好奇，想询问“这个尝起来是什么味道？”或“这个好吃吗？”。
1706638111,生鲜水果,"小明跟去年比,已经各种吃把自己吃废了",0,该用户是在调侃主播小明因为长期试吃商品导致身材走样，言语中带着善意的玩笑和关心。
1706638111,生鲜水果,"甘肃,宁夏,陕西,内蒙,山西都有胡麻",0,该用户是在补充说明胡麻的产地分布广泛，暗示对这种作物或其制品（如胡麻油）有潜在兴趣或了解意愿。
1706638111,生鲜水果,看一眼陈行甲书记吧![呲牙][呲牙][呲牙],0,该用户可能在表达对陈行甲书记的喜爱或支持，希望主播能多关注或提及他。
1706638111,生鲜水果,西北也有,0,该用户想表达的含义是：胡麻油在西北地区同样常见。
1706638111,生鲜水果,胡麻油西北人都吃,0,该用户想表达的含义是：胡麻油在西北地区是一种普遍食用的常见食用油。
1706638111,生鲜水果,拍了一单加急发货,0,该用户想表达自己已经下单并希望尽快收到商品。
1706638111,生鲜水果,胡麻籽油大部分人吃不惯,0,该用户想表达的含义是：胡麻籽油的口味比较小众，可能不太符合大众的饮食习惯。
1706638111,生鲜水果,甘肃小苹果[色]半红半白[色],0,该用户被甘肃小苹果的外观吸引，表达了对这款产品的喜爱和购买兴趣。
1706638111,生鲜水果,生吃油[捂脸],0,该用户是在调侃主播尝试生吃胡麻油的举动，觉得这种行为很离谱或难以接受。
1706638111,生鲜水果,"在明哥这买过乌鸡蛋特别新鲜,品质高",1,该用户想表达的含义是：对主播之前售卖的乌鸡蛋品质表示认可，并暗示有继续回购或尝试其他产品的意愿。  （结合前文语境，直播间正在讨论各类农产品，用户通过正面评价过往购物体验，既肯定了主播选品能力，也透露出对直播间商品的持续关注和信任。）
1706638111,生鲜水果,我们河北省张家口市多的是麻油,0,该用户想表达的含义是：我们当地盛产这种麻油，并不稀罕。  （结合前文弹幕中关于胡麻油地域分布的讨论，用户意在强调麻油在其家乡的普遍性，可能隐含对产品宣传的不以为然或补充地域信息。）
1706638111,生鲜水果,真给力,0,该用户想表达的含义是：主播的优惠力度或产品介绍让人非常心动。
1706638111,生鲜水果,这样吃下去更恶心,0,该用户可能是在吐槽主播试吃某种食品（如胡麻油相关产品）的方式或状态让人感到不适，暗示这种吃相或食用方法令人反感。
1706638111,生鲜水果,"胡麻油很好,价格高",0,该用户认为胡麻油品质不错但觉得售价偏贵，在认可产品的同时对价格有所顾虑。
1706638111,生鲜水果,一百多一斤花椒实惠吗?,0,该用户是在询问当前直播中售卖的花椒价格是否划算，暗示对购买该产品有兴趣但需要确认性价比。
1706638111,生鲜水果,这样吃会拉肚,0,该用户是在调侃主播的吃法不健康，可能会引发肠胃不适。
1706638111,生鲜水果,"哈哈,浆水卖的多[捂脸]",0,该用户是在调侃主播频繁推销浆水（一种西北特色食品）的行为，用幽默口吻暗示产品推销过于密集。
1706638111,生鲜水果,这个特别香,1,该用户是在称赞当前展示的商品气味诱人，暗示有购买意向。
1706638111,生鲜水果,在明哥这买过乌鸡蛋特别新鲜,1,该用户想表达的含义是：认可主播推荐的商品品质可靠，并暗示自己是有复购意愿的老客户。
1706638111,生鲜水果,"胡麻油,是什么油",0,该用户可能对胡麻油不太了解，想询问它的具体来源或特点。
1706638111,生鲜水果,是胡麻油吗,1,该用户可能是在询问直播中展示的产品是否为胡麻油，表现出对商品具体品类的关注和潜在的购买兴趣。
1706638111,生鲜水果,有茶叶吗?,1,该用户可能在询问直播间是否有茶叶产品在售，表现出对茶叶的潜在购买兴趣。
1706638111,生鲜水果,有水果么今天?,1,该用户是在询问直播间今天是否有售卖水果类商品。
1706638111,生鲜水果,有糯玉米吗,1,该用户是在询问直播间是否有售卖糯玉米这一商品。
1706638111,生鲜水果,卖的东西很你不一样,0,该用户想表达的含义是：你卖的商品和其他商家的不太一样（可能是品类或特色上的差异）。
1706638111,生鲜水果,陈行甲徒弟,0,"该用户可能在询问主播或产品是否与知名人物""陈行甲""有关联，试图通过名人效应来评估商品的可信度或品质。"
1706638111,生鲜水果,荞麦面有不,1,该用户是在询问直播间是否有荞麦面在售。
1706638111,生鲜水果,有茶叶吗,1,该用户是在询问直播间是否有茶叶商品在售，表现出对茶叶产品的潜在购买兴趣。
1706638111,生鲜水果,小李书记,0,该用户可能在询问或提及直播间的某个特定人物（如主播或工作人员）“小李书记”的相关信息或互动。
1706638111,生鲜水果,胡麻油很好吃,1,该用户想表达的含义是：对胡麻油的品质表示认可并可能有意向购买。
1706638111,生鲜水果,百毒不侵了[赞],0,该用户想表达的含义是：对主播推荐的产品质量或效果非常信任和认可。  （结合前文弹幕中频繁提及“胡麻油”等食品，且部分用户反馈正面体验，该弹幕可能是针对某款产品的功效或主播的推荐表达肯定，用“百毒不侵”夸张形容其可靠性或健康价值。）
1706638111,生鲜水果,刚才花椒的怎么没怎么介绍就走了,0,该用户对花椒产品的介绍不充分感到不满，认为主播没有详细讲解就匆匆带过了这个商品。
1706638111,生鲜水果,在明哥这买的乌鸡蛋特别新鲜,1,该用户是在通过分享积极的购物体验来肯定主播的商品品质，暗示自己对该产品满意并可能再次购买。
1706638111,生鲜水果,买一桶试试,1,该用户对当前直播中提到的商品（可能是胡麻油或其他食品）产生了兴趣，打算先少量购买体验效果。
1706638111,生鲜水果,已拍加急,0,该用户想表达的含义是：我已经下单购买了商品并选择了加急配送服务。
1706638111,生鲜水果,有西红柿吗,1,该用户想询问直播间是否售卖西红柿，可能有意向购买。
1706638111,生鲜水果,甘肃苦荞茶好,1,该用户对甘肃苦荞茶表现出明确的购买意向，认为该产品品质优良值得推荐。
1706638111,生鲜水果,小明哥不能吃了[捂脸][捂脸][捂脸][捂脸],0,该用户可能是以调侃或惋惜的语气表达“小明哥（主播）不能再继续试吃或推荐某样商品了”。  （结合前文弹幕中频繁提及具体商品如胡麻油、茶叶、乌鸡蛋等，且主播昵称被多次称呼为“明哥”，推测此时主播可能因试吃过多或时间限制暂停展示商品，用户用表情符号强化幽默或无奈情绪。）
1706638111,生鲜水果,技麻油吗?,0,该用户是在询问直播中是否有售卖胡麻油。
1706638111,生鲜水果,"昨晚开03真准,懂得来点点关注",0,该用户是在夸赞主播昨晚对商品（可能是编号03的产品）的介绍准确到位，并号召懂行的观众关注主播。
1706638111,生鲜水果,百合还有吗?,1,该用户是在询问直播间是否还有百合产品在售。
1706638111,生鲜水果,西红柿西红柿有没有?,1,该用户是在询问直播间是否有西红柿在售，表现出明确的购买意向。
1706638111,生鲜水果,今天全是面,0,该用户可能是在抱怨或调侃今天直播间的商品种类过于单一，全是面食类产品。
1706638111,生鲜水果,"香菇酱,香菇酱,香菇酱,香菇酱,香菇酱",1,"该用户可能是急切询问或强烈要求主播介绍/上架香菇酱产品。  （分析依据：连续重复关键词是直播间常见的催促行为，结合前文弹幕中频繁出现对具体商品的询问（如""荞麦面""""西红柿""""百合""等），且存在已购用户反馈（""胡麻油很好吃""），可推断该弹幕属于典型的需求表达模式。）"
1706638111,生鲜水果,小米小米小米有吗?,1,该用户是在询问直播间是否有小米产品在售。
1706638111,生鲜水果,胡麻油很香的,1,该用户是在表达对胡麻油的正面评价，暗示有购买意向或推荐他人尝试。
1706638111,生鲜水果,甘肃苦荞茶,0,该用户可能是在询问或确认直播间是否有甘肃苦荞茶这款产品，并暗示对该商品存在购买兴趣。
1706638111,生鲜水果,全是面,0,该用户可能是在吐槽或感叹当前直播中展示的商品过于单一，基本都是面食类产品。
1706638111,生鲜水果,"在明哥这买过乌鸡蛋特别新鲜,品质高[赞]",1,该用户通过分享之前的购买体验，表达了对主播推荐商品的信任和认可，暗示有继续购买的意愿。
1706638111,生鲜水果,全是面吃不来,0,该用户想表达的含义是：对当前直播中频繁推荐面食类商品感到厌倦或不感兴趣。
1706638111,生鲜水果,上次买的梨子没有几个好的,0,该用户可能是在抱怨之前购买的水果品质不佳，暗示对本次直播的商品质量有所顾虑或希望主播能提供更好的售后保障。
1706638111,生鲜水果,加油jiayou,0,该用户可能在为直播主播或某个产品加油打气，表达支持鼓励的态度。
1706638111,生鲜水果,"菠菜做的,通风不能吃",0,该用户想表达的含义是：这款菠菜制品不适合痛风患者食用。
1706638111,生鲜水果,晚上不用吃饭了,0,该用户想表达的含义是：直播中展示的食物看起来太诱人，已经看饱了不用再吃晚饭了。
1706638111,生鲜水果,麻食好吃,1,该用户可能是在对直播中展示的麻食产品表示认可或产生购买兴趣，暗示自己觉得这款食物看起来美味或想尝试购买。
1706638111,生鲜水果,加油加油,0,该用户可能在为直播间的促销活动或主播的表现鼓劲助威，表达对直播内容的支持与热情。
1706638111,生鲜水果,正能量,0,该用户可能在为直播间的积极氛围或主播的卖力表现点赞打气。
1706638111,生鲜水果,茶叶有没有,1,该用户是在询问直播间是否有茶叶商品在售。
1706638111,生鲜水果,香菇酱,1,该用户是在询问或表达对直播间正在介绍的香菇酱产品的兴趣或购买意向。
1706638111,生鲜水果,明哥饭都不吃了,0,该用户想表达的含义是：明哥直播间的商品太吸引人，让人顾不上吃饭了。
1706638111,生鲜水果,有粉条么,1,该用户是在询问直播间是否有粉条这款商品在售。
1706638111,生鲜水果,这个好,1,该用户想表达的含义是：对当前直播展示的商品表示认可或产生购买兴趣。  （结合前文弹幕中频繁出现的具体商品名称和购买讨论，如“香菇酱”“小米”“胡麻油”等，可推断“这个好”是针对主播正在介绍的产品发出的积极反馈，可能是被商品特点吸引或认可其性价比。）
1706638111,生鲜水果,荞麦面粉有吗?,1,该用户是在询问直播间是否有售卖荞麦面粉这一商品。
1706638111,生鲜水果,葛根粉,1,该用户可能在询问直播间是否有葛根粉这款产品出售。
1706638111,生鲜水果,这个还没讲解我就已经买了[捂脸],0,该用户想表达的含义是：我对这款产品非常信任和喜爱，甚至等不及主播介绍就直接下单了。
1706638111,生鲜水果,甘肃拉面之乡[色]小苹果之乡[色],0,该用户想表达的含义是：对甘肃特色农产品（如拉面和小苹果）表现出浓厚的兴趣和喜爱。
1706638111,生鲜水果,有没有糯玉米,1,该用户是在询问直播间是否有售卖糯玉米这一商品。
1706638111,生鲜水果,南方人确实是不喜欢,0,该用户想表达的含义是：作为南方人，我对当前展示的面食类产品不太感兴趣。
1706638111,生鲜水果,胡麻油为什么实物与链接颜色不一样?,0,该用户可能对产品颜色差异产生疑问，担心存在货不对版或质量问题，想通过弹幕询问主播以确认商品实际情况是否符合预期。
1706638111,生鲜水果,甘肃天天吃面土豆,0,该用户可能在调侃甘肃的饮食习惯以面食为主，同时暗示对当地特色食品（如土豆）的兴趣或好奇。
1706638111,生鲜水果,"大家是支持了,你韭菜也割家人们了",0,该用户是在讽刺主播利用粉丝支持割韭菜的行为，暗示主播过度消费粉丝的信任和热情来牟利。
1706638111,生鲜水果,好帅啊,0,该用户可能是在称赞主播或产品的外观吸引人，表达了对直播内容的欣赏和兴趣。
1706638111,生鲜水果,已拍加急,0,该用户想表达的含义是：我已经下单并选择了加急配送服务。
1706638111,生鲜水果,拍了加急,0,该用户想表达的含义是：我已经下单并选择了加急配送服务。
1706638111,生鲜水果,什么面,1,该用户可能在询问直播间正在介绍或展示的面食产品具体是什么种类或品牌。
1706638111,生鲜水果,"在明哥这买的乌鸡蛋特别新鲜,品质真好[赞]",1,该用户通过称赞之前购买的乌鸡蛋品质好，表达了对主播的信任和对商品的认可，暗示可能会继续支持或回购。
1706638111,生鲜水果,甘肃通渭苦荞茶好喝[赞][赞][赞],0,该用户通过称赞甘肃通渭苦荞茶的口味并附上多个点赞表情，暗示对产品的高度认可和潜在的复购意愿，同时可能希望主播对该产品进行更多介绍或促销互动。
1706638111,生鲜水果,武汉周黑鸭上车,0,"该用户想表达的含义是：询问直播间是否会上架武汉周黑鸭这款商品并希望尽快购买。  （结合前文弹幕中频繁出现的商品询问、地域特产讨论以及""上车""等购物暗示用语，可推断用户以地域特色食品为关注点，用""上车""表达抢购意向。）"
1706638111,生鲜水果,"昨晚开03真准,懂得来点点关注",0,该用户是在炫耀自己昨晚成功预测了直播中的某个产品（可能是03号商品）并呼吁其他懂行的观众关注主播，暗示自己对该领域有经验且判断准确。
1706638111,生鲜水果,"甘肃人实在,产品质量好[赞]",1,该用户是在称赞甘肃产品的品质可靠，并隐含对产地诚信度的认可，可能产生进一步了解或购买意向。
1706638111,生鲜水果,小宝宝可以吃?,1,该用户是在询问直播中展示的产品是否适合婴幼儿食用，表现出对产品适用人群的具体关注和潜在的购买意向。
1706638111,生鲜水果,拍了回来煮,0,该用户想表达的含义是：已经下单购买产品准备回家烹饪。
1706638111,生鲜水果,美美哒,0,该用户可能是在称赞直播中展示的商品外观或主播的穿搭很漂亮，表达了对当前画面的欣赏和喜爱。
1706638111,生鲜水果,性价比很高,1,该用户认为产品价格合理且品质值得购买。
1706638111,生鲜水果,"主播下午好,有红薯呜?",0,该用户可能在询问主播是否有红薯产品并表达购买意向。
1706638111,生鲜水果,"不加盐健康[捂脸],胡说八道[捂脸]",0,该用户是在反驳主播关于“不加盐更健康”的说法，认为这种观点没有科学依据，并用调侃的语气表达不认同。
1706638111,生鲜水果,@老猫（互粉）[送心],0,该用户可能是主播的粉丝或熟人，通过互动表情和求互粉的方式来活跃气氛并表达支持，但并未直接表现出购买意向。
1706638111,生鲜水果,这鸡蛋好,1,该用户想表达的含义是：这款鸡蛋看起来品质不错，我挺感兴趣的。
1706638111,生鲜水果,不要臭的吀,0,该用户可能在质疑或提醒主播注意商品质量，担心收到的货品会有异味问题。
1706638111,生鲜水果,"蛋黄太红了,喂了苏丹红?",0,该用户可能在质疑蛋黄颜色异常，怀疑商家在饲料中添加了违禁色素苏丹红。
