live_id,species,content,label,background
shisan66,生鲜水果,草莓西红柿,1,该用户可能在询问直播中是否有售卖草莓西红柿这一品种的农产品。
shisan66,生鲜水果,樱桃多久可以发货,0,该用户想询问购买樱桃后的大致发货时间，以评估收货等待周期。
shisan66,生鲜水果,菠萝蜜,1,该用户想表达的含义是：询问直播间是否有菠萝蜜这款商品在售。
shisan66,生鲜水果,菠萝蜜有吗,1,该用户是在询问直播间是否有菠萝蜜这款商品在售。
shisan66,生鲜水果,带咯某了,0,该用户想表达的含义是：我也要下单购买了。  （结合前文弹幕高频出现的购买意向和发货咨询，用户可能是受氛围感染，用方言或口语化表达跟进购买意愿。）
shisan66,生鲜水果,哈密瓜,1,该用户可能在询问直播间是否有哈密瓜售卖或想了解哈密瓜的相关信息。
shisan66,生鲜水果,"草莓,西红柿",1,该用户可能是在询问或表达对直播中提到的草莓和西红柿这两种商品的兴趣，比如想了解它们的售卖信息或表示想购买。
shisan66,生鲜水果,哦哦提供了,0,该用户想表达的含义是：明白了主播提供的发货信息。
shisan66,生鲜水果,在几号链接呀,1,该用户想询问商品对应的购买链接编号以便下单。
shisan66,生鲜水果,"沃柑过时了,上点应季的",1,该用户是在催促主播更换当前推销的过季水果沃柑，希望推荐更符合时令的新鲜产品。
shisan66,生鲜水果,蓝莓发什么快递,0,该用户是在询问蓝莓产品的具体物流配送方式。
shisan66,生鲜水果,快上车吧,1,该用户可能在催促主播尽快上架或推荐当前热门的商品，表达出急切想要参与抢购的心情。
shisan66,生鲜水果,大连打开,0,该用户可能在询问直播中展示的大连特产（如樱桃等水果）的购买链接或详情。
shisan66,生鲜水果,看看品质,1,该用户想表达的含义是：想进一步了解商品的质量细节以便决定是否购买。
shisan66,生鲜水果,哈尔滨,0,该用户可能是在询问直播间是否有售卖哈尔滨特产或相关商品。
shisan66,生鲜水果,东北打开,0,该用户可能是想询问商品是否支持发往东北地区或询问东北地区的物流情况。
shisan66,生鲜水果,辽宁打开,0,该用户想表达的含义是：询问直播间是否支持辽宁地区的订单配送或服务开通。
shisan66,生鲜水果,蓝莓呢,1,该用户是在询问直播间是否有蓝莓产品上架或为何没有展示蓝莓。
shisan66,生鲜水果,玉米吧,1,该用户可能在询问直播间是否有玉米商品上架或推荐。
shisan66,生鲜水果,要辣的,1,该用户想表达的是希望主播推荐或展示辣味的产品。
shisan66,生鲜水果,找谁可以解决问题,0,该用户可能在询问如何联系客服或负责人来解决当前直播中未展示或未解答的某个商品问题。
shisan66,生鲜水果,"辣椒鸡蛋焖子,贼香",0,该用户是在对主播推荐的“辣椒鸡蛋焖子”表示强烈的兴趣和认可，暗示自己有意购买或认为这道菜很诱人。  （结合前文弹幕中多次出现对农产品（如蓝莓、玉米、沃柑）和口味偏好（如“要辣的”）的讨论，以及“几号链接”“发货”等购物相关提问，可推断当前直播间正在推销食品类商品，用户通过夸赞产品来互动并可能促成购买行为。）
shisan66,生鲜水果,能看见我的问题吗,0,该用户可能因之前询问的问题未被主播及时回应，担心自己的留言被忽略，因此再次发弹幕确认是否被看到。
shisan66,生鲜水果,这么多[捂脸],0,该用户可能是对直播间频繁刷屏无关内容感到无奈，用表情委婉表达“话题跑偏了”或“怎么都在聊别的”。
shisan66,生鲜水果,十三卖货有实力[赞][赞],0,该用户是在称赞主播的带货能力出色，表达了对主播专业度的认可和欣赏。
shisan66,生鲜水果,感谢十三,0,该用户是在对主播“十三”的带货表现或解答服务表达认可与感谢。
shisan66,生鲜水果,有几斤,1,该用户想询问主播所售商品的具体重量规格。
shisan66,生鲜水果,娜可露露露露,0,该用户可能是在询问或催促主播介绍或上架“娜可露露”这款产品（可能是水果或其他商品）。
shisan66,生鲜水果,哈哈哈哈十三卖蔬菜了,0,该用户想表达的含义是：觉得主播十三卖蔬菜这件事很有趣或出乎意料。
shisan66,生鲜水果,特伦苏牛奶吗,1,该用户是在询问直播间是否有售卖特仑苏牛奶，并对其产品表现出兴趣。
shisan66,生鲜水果,怎么保存,1,该用户可能是在询问如何保存当前直播中展示的商品（如蓝莓或玉米）的方法。
shisan66,生鲜水果,讲讲那个虾酱吧,1,该用户对直播中提到的虾酱产品产生了兴趣，希望主播能详细介绍其特点和卖点。
shisan66,生鲜水果,后面那个怎么总是抢啊,0,该用户可能对某个商品或环节被频繁抢购感到不满或焦急，暗示希望有更多购买机会或公平的参与体验。
shisan66,生鲜水果,玉米好了吗,1,该用户是在询问直播中提到的玉米产品是否已经上架或可以购买了。
shisan66,生鲜水果,百香果,1,该用户可能是在询问或提及直播间正在展示或讨论的百香果产品，表达了对该商品的兴趣或想了解更多信息。
shisan66,生鲜水果,洋葱是好东西,1,该用户可能是在认可主播推荐的洋葱产品，暗示自己有兴趣购买或认为洋葱是个不错的选品。
shisan66,生鲜水果,想要莴笋,1,该用户表达了对直播中展示的莴笋有购买意向或询问相关商品信息。
shisan66,生鲜水果,草莓西红柿,1,该用户想表达的含义是：询问直播间是否有草莓西红柿这款商品或对其感兴趣。
shisan66,生鲜水果,上百香果,1,该用户可能是想询问或确认直播间是否有售卖百香果。
shisan66,生鲜水果,辣吗,1,该用户是在询问直播中展示的食品（可能是辣椒或辣味产品）的辣度程度。
shisan66,生鲜水果,讲讲那个虾酱吧,1,该用户对直播中提到的虾酱产品产生了兴趣，希望主播能详细介绍其特点和卖点。
shisan66,生鲜水果,你直播间买的白色保温瓶很好送我奶奶了,0,该用户想表达的含义是：之前在直播间购买的白色保温瓶使用体验不错，已经作为礼物送给长辈了。
shisan66,生鲜水果,水果洋葱吗,1,该用户可能在询问直播中展示的洋葱是否是水果洋葱品种。
shisan66,生鲜水果,几天发货洋葱,0,该用户想询问洋葱的发货时间。
shisan66,生鲜水果,吃洋葱对身体好[赞],0,该用户是在认可洋葱的健康价值，并可能暗示对购买洋葱感兴趣。
shisan66,生鲜水果,再切要流眼泪了[笑哭],0,该用户是在用幽默的方式表达对主播频繁切镜头或切换商品的不耐烦，暗示自己快被“感动哭了”。
shisan66,生鲜水果,莴笋啥样,1,该用户想询问直播中展示的莴笋的具体外观特征或品质情况。
shisan66,生鲜水果,支持支持支持支持支持支持支持支持支持支持支持支持支持支持支持支持支,0,该用户想表达的含义是：通过重复刷屏的方式表达对主播或商品的强烈支持和喜爱。
shisan66,生鲜水果,晚上好,0,该用户可能是在礼貌性地打招呼，试图融入直播间的互动氛围，但并未直接表达明确的购买意向。
shisan66,生鲜水果,应该再买个大酱,0,该用户可能是在观看直播中提到的某种酱料后，产生了追加购买同类商品的意愿，暗示对当前推荐商品感兴趣并考虑增加囤货。
shisan66,生鲜水果,怎么都生啃[笑哭][笑哭],0,该用户可能是对直播中展示的某种食材（如洋葱）被直接生吃的做法感到惊讶或好笑，用调侃的语气表达不解。
shisan66,生鲜水果,讲讲虾酱吧,1,该用户希望主播详细介绍虾酱这款产品的相关信息。
shisan66,生鲜水果,能有几个,1,该用户可能是在询问某种商品（如百香果或洋葱）的购买数量或库存情况。
shisan66,生鲜水果,虾酱有么,1,该用户是在询问直播间是否有虾酱产品在售或准备上架。
shisan66,生鲜水果,十三好可爱,0,该用户是在夸赞主播或商品的外观或表现很讨人喜欢，表达了对直播内容的积极情感和关注。
shisan66,生鲜水果,有百香果吗,1,该用户是在询问直播间是否有百香果这款商品上架售卖。
shisan66,生鲜水果,肯定辣,0,该用户是在询问或确认主播展示的产品（可能是某种食物或调料）是否具有辣味特征。
shisan66,生鲜水果,希望说实话,0,该用户可能是在质疑主播对产品介绍的真实性，希望对方能坦诚描述商品特点而非夸大宣传。
shisan66,生鲜水果,铁打的胃啊,0,该用户是在调侃主播或观众能吃辣或消化能力强，可能是在看到有人生吃辛辣食材（如洋葱、百香果）或讨论辣味食品（虾酱）后发出的感叹。
shisan66,生鲜水果,百香果,1,该用户是想询问直播间是否有百香果在售。
shisan66,生鲜水果,讲讲虾酱吧,1,该用户对直播中提到的虾酱产品产生了兴趣，希望主播能详细介绍其特点或优惠信息。
shisan66,生鲜水果,这个和羊角蜜哪个好吃些啊,1,该用户可能在比较当前直播中介绍的某种水果（可能是甜瓜类）与羊角蜜的口感或品质，想了解两者哪个更值得购买。
shisan66,生鲜水果,为什么剃皮,0,该用户可能是对直播中展示的某种水果或蔬菜（如莴笋、羊角蜜等）的处理方式感到疑惑，询问为何需要削皮或去皮。
shisan66,生鲜水果,最喜欢的甜瓜,1,该用户想表达的含义是：对直播中展示的甜瓜品种表现出强烈的喜爱和购买倾向。
shisan66,生鲜水果,有释迦果吗,1,该用户是在询问直播间是否有售卖释迦果这一商品。
shisan66,生鲜水果,上车妹子,0,该用户想表达的含义是：询问如何参与购买或加入购物车。
shisan66,生鲜水果,几分甜,1,该用户可能是在询问主播当前展示的水果或甜品的甜度等级或口感评价。
shisan66,生鲜水果,有优惠么,1,该用户想询问当前直播中是否有促销活动或折扣信息。
shisan66,生鲜水果,都是熟的,0,该用户想表达的含义是：这些水果都已经熟透了可以直接吃。  （结合前文弹幕中讨论生啃、甜瓜、释迦果等水果相关话题，推测用户是在回应关于水果成熟度的疑问或评价当前展示商品的品相状态。）
shisan66,生鲜水果,"默默姥姥考虑咯的啊,是驱魔姥姥路",0,该用户可能在随意调侃或打趣，表达一种无厘头的幽默感，并非真正询问商品信息或表达购买意向。
shisan66,生鲜水果,谣言止于智者在中央音乐学院,0,该用户可能在调侃或讽刺直播间里关于产品的不实宣传或夸大描述，暗示观众应该理性辨别信息。
shisan66,生鲜水果,大约几个,1,该用户想询问产品的大致数量或规格。
shisan66,生鲜水果,三斤几个啊,1,该用户是在询问商品（可能是水果或按重量销售的产品）三斤大概包含多少个单品。
shisan66,生鲜水果,有凤梨吗,1,该用户是在询问直播间是否有售卖凤梨这款水果。
shisan66,生鲜水果,什么时候发货,0,该用户想知道商品下单后的具体配送时间。
shisan66,生鲜水果,都买啦,0,该用户想表达的含义是：我已经决定购买所有推荐的商品了。
shisan66,生鲜水果,皮硬吗,1,该用户是在询问直播中展示的水果（可能是甜瓜或释迦果）的外皮质地是否坚硬。
shisan66,生鲜水果,我在超市买这个前面很苦,0,该用户想表达的含义是：我之前在超市买的这种水果前端部分味道偏苦。
shisan66,生鲜水果,有几个,1,该用户想询问商品的具体数量或规格。
shisan66,生鲜水果,大概几个,1,该用户想询问的是商品的具体数量或包装规格。
shisan66,生鲜水果,"拍了,希望好吃",0,该用户想表达的含义是：已经下单购买了产品，期待商品品质符合预期。
shisan66,生鲜水果,樱桃呢,1,该用户可能在询问直播间是否有樱桃售卖或为何还未介绍樱桃产品。
shisan66,生鲜水果,樱桃樱桃,1,该用户是在询问或催促主播介绍或上架樱桃产品。
shisan66,生鲜水果,樱桃樱桃十三,1,该用户是在急切询问或确认直播间是否有售卖“樱桃十三”这个品种的樱桃。
shisan66,生鲜水果,百香果,1,该用户可能在询问直播间是否有百香果售卖或想了解百香果的相关信息。
shisan66,生鲜水果,北极虾有吗,1,该用户是在询问直播间是否有售卖北极虾这款产品。
shisan66,生鲜水果,上链接吧就等樱桃呢,1,该用户急切地催促主播尽快上架樱桃商品，表现出强烈的购买意愿。
shisan66,生鲜水果,甜度高,0,该用户可能在询问或确认所讨论水果（如樱桃或凤梨）的甜度是否符合期望。
shisan66,生鲜水果,嘎嘣脆,0,该用户想表达的含义是：询问或评价商品的酥脆口感如何。
shisan66,生鲜水果,糖度高,0,该用户是在询问或确认直播中所售水果的甜度是否足够高。
shisan66,生鲜水果,还有黄樱桃,1,该用户是在询问直播间是否还有黄色樱桃的库存或是否会补货。
shisan66,生鲜水果,前天拍的什么时候发货啊,0,该用户想确认自己之前下单的商品何时能收到货。
shisan66,生鲜水果,樱桃几天能发货啊,0,该用户想询问樱桃产品的具体发货时间，以确认收货安排是否符合自身需求。
shisan66,生鲜水果,发啥快递,0,该用户想询问商家会使用哪家快递公司配送商品。
shisan66,生鲜水果,啥时候发货,0,该用户想询问自己所购买商品的预计发货时间，表现出对收货进度的关注和期待。
shisan66,生鲜水果,现在发货什么时候收到,0,该用户想询问当前下单的商品预计何时能送达。
shisan66,生鲜水果,现在拍什么时候发货,0,该用户想询问当前下单的商品预计何时能发出并送达。
shisan66,生鲜水果,啥时候发货,0,该用户想询问购买商品后的具体发货时间安排。
shisan66,生鲜水果,你为啥卖那么便宜,0,该用户可能对商品低价感到意外或质疑其质量，想了解价格便宜的具体原因。
shisan66,生鲜水果,我就在大连,0,该用户可能是在询问自己所在的大连地区是否能享受相关配送或优惠服务。
shisan66,生鲜水果,什么时候发货,0,该用户想询问下单后商品的大致发出时间，以确认收货安排。
shisan66,生鲜水果,上链接呀,1,该用户急切催促主播尽快开放商品购买通道，表现出强烈的购买意愿。
shisan66,生鲜水果,鱿鱼仔孕妇能吃吗,1,该用户是在询问鱿鱼仔是否适合孕妇食用，可能出于对产品安全性的考虑或为孕妇选购零食的意图。
shisan66,生鲜水果,上链接,1,该用户急切催促主播尽快开放商品购买通道以便抢购。
shisan66,生鲜水果,什么时候发货,0,该用户想询问自己购买的商品预计何时能发出物流。
shisan66,生鲜水果,洛川苹果有吗,1,该用户是在询问直播间是否有售卖洛川苹果这一商品。
shisan66,生鲜水果,啥时候发货啊,0,该用户想询问商品的预计发货时间以确认收货安排。
shisan66,生鲜水果,鱿鱼仔孕妇能吃吗,1,该用户是在询问鱿鱼仔这种食品是否适合孕妇食用，以考虑是否购买。
shisan66,生鲜水果,这是那个,1,该用户想表达的含义是：这是之前提到的那款商品吗？
shisan66,生鲜水果,这个多大,1,该用户想询问商品的尺寸或规格信息。
shisan66,生鲜水果,发什么快递,0,该用户想询问商品配送所使用的快递公司信息。
shisan66,生鲜水果,把袋子拿出来看看,1,该用户想表达的含义是：希望主播展示商品包装或容器的实物细节。
shisan66,生鲜水果,是现货吗,1,该用户想确认商品是否有库存可以立即发出。
shisan66,生鲜水果,你手上这个是几沟的,1,该用户想询问主播手中展示的商品具体是哪种规格或等级的。
shisan66,生鲜水果,昨天拍的早点发货,0,该用户希望催促商家尽快处理自己前一天下单的商品的发货事宜。
shisan66,生鲜水果,什么时候发货,0,该用户想询问商品的发货时间以确认收货安排。
shisan66,生鲜水果,甜度怎么样,1,该用户想询问产品的甜度是否适合自己口味，以决定是否购买。
shisan66,生鲜水果,主播手上的果是多大的果,1,该用户想询问主播手中展示的水果的具体尺寸规格。
shisan66,生鲜水果,净重吗,1,该用户是在询问商品的包装重量是否已经扣除，即是否为实际产品的重量。
shisan66,生鲜水果,这是多大的,1,该用户想询问主播展示的商品的具体尺寸或规格。
shisan66,生鲜水果,手上是多大,1,该用户想询问主播手中展示的商品的具体尺寸规格。
shisan66,生鲜水果,"哇,你居然看到我发的信息了,好高兴啊",0,该用户想表达的含义是：因主播回应了自己的互动而感到惊喜和开心。
shisan66,生鲜水果,这个是几J的,1,该用户想询问主播展示的商品的具体规格等级（如水果的大小分级）。
shisan66,生鲜水果,发啥快递,0,该用户想询问商品的配送方式或快递公司信息。
shisan66,生鲜水果,这个是多大的,1,该用户想询问主播展示的商品的具体尺寸或规格。
shisan66,生鲜水果,吃这个是多大的,1,该用户想询问主播展示的商品的具体尺寸或规格。
shisan66,生鲜水果,推荐哪个,1,该用户想表达的含义是：希望主播在众多同类商品中给出具体的选购建议。
shisan66,生鲜水果,这可逮住了,0,该用户想表达的含义是：终于找到我想要了解的产品信息了。
shisan66,生鲜水果,多久发货,0,该用户想了解商品的发货时效，以评估是否满足自己的购买需求。
shisan66,生鲜水果,都甜吗,1,该用户是在询问直播中展示的水果是否全部都具有较高的甜度。
shisan66,生鲜水果,沃柑多久发货,1,该用户想询问沃柑的具体发货时间，表现出对下单后物流效率的关注和潜在的购买意愿。
shisan66,生鲜水果,发什么快递,0,该用户想询问商品配送时会选用哪家快递公司。
shisan66,生鲜水果,几天发货呀,0,该用户想询问商品的发货时效，表现出对下单后收货时间的关注和潜在的购买意向。
shisan66,生鲜水果,你们卖的多宝鱼宝宝吗,1,该用户是在询问直播间是否有售卖多宝鱼的幼鱼产品。
shisan66,生鲜水果,有和田大枣吗,1,该用户是在询问直播间是否售卖和田大枣这款商品。
shisan66,生鲜水果,对比看看,1,该用户想表达的含义是：希望主播对不同规格或款式的商品进行详细比较，以便自己做出购买决策。
shisan66,生鲜水果,发啥快递,0,该用户想询问商品配送所使用的快递公司或物流方式。
shisan66,生鲜水果,对比看看吧,1,该用户可能是想在不同产品规格或选项之间进行比较后再决定购买。
shisan66,生鲜水果,是现货吗,1,该用户想确认商品是否为现成可立即发货的库存。
shisan66,生鲜水果,牛油果,1,该用户可能是在询问直播中展示的牛油果的规格或品质等级。
shisan66,生鲜水果,昨天买了,0,该用户想表达的含义是：自己已经下单购买了这款商品。
shisan66,生鲜水果,发几斤,1,该用户想询问商品的具体发货重量或包装规格。
shisan66,生鲜水果,是顺丰发货吗,0,该用户想确认商品是否通过顺丰快递配送，以评估物流服务的质量和速度。
shisan66,生鲜水果,俄罗斯的果看看,1,该用户想表达的含义是：想看看俄罗斯进口的水果产品。
shisan66,生鲜水果,推荐几J,1,该用户想询问主播推荐的产品规格或重量选项。
shisan66,生鲜水果,发几斤呀,1,该用户是在询问商品的具体发货重量或包装规格。
shisan66,生鲜水果,哈尔滨红肠咋吃,1,该用户想询问哈尔滨红肠的食用方法或推荐吃法。
shisan66,生鲜水果,现货吗,1,该用户想确认商品是否为现成库存、能否立即发货。
shisan66,生鲜水果,推荐几J,1,该用户是想询问主播推荐商品的规格或等级（如水果的“J”代表大小等级）。
shisan66,生鲜水果,什么时候发货呢,0,该用户想询问商品的发货时效以确认收货时间安排。
shisan66,生鲜水果,几天发货,0,该用户想询问商品的具体发货时间。
shisan66,生鲜水果,十三想买手表,1,该用户想表达的含义是：对直播中展示的手表产生了购买意向。
shisan66,生鲜水果,发什么快递,0,该用户想询问商品的物流配送方式。
shisan66,生鲜水果,我是大连的,0,该用户想表达的含义是：询问商品是否支持发货到大连地区。
shisan66,生鲜水果,推荐哪个,1,该用户想询问主播针对当前展示的商品或品类有什么具体的购买建议或推荐选项。
shisan66,生鲜水果,你那个是几J,1,该用户是在询问主播推荐的水果规格等级（如“3J”“4J”等），以了解产品的具体大小或品质档次。
shisan66,生鲜水果,你啥时候卖手表就是那个抹苹果那个,0,该用户想询问主播何时会上架一款涂抹苹果（可能指苹果品牌或苹果味）的手表产品。
shisan66,生鲜水果,海带是熟的吗,1,该用户是在询问直播中展示的海带产品是否经过加工处理可以直接食用。
shisan66,生鲜水果,美美卖的海鲜质量可好了[赞],0,该用户是在称赞主播所售海鲜的品质优良，并隐含对商品的认可和购买意愿。
shisan66,生鲜水果,看护肤品吗[捂脸],1,该用户可能是在调侃或委婉询问主播是否会推荐护肤品，表现出一定的兴趣但带有随意或观望的态度。
shisan66,生鲜水果,推荐几J,1,该用户想询问主播推荐的商品规格或等级（如水果的“J”代表大小等级）。
shisan66,生鲜水果,洛川苹果,1,该用户可能是在询问主播是否有售卖或推荐洛川苹果的规格和品质。
shisan66,生鲜水果,手里的是几j的,1,该用户是在询问主播手中展示的商品规格等级（例如水果的大小等级“J”代表尺寸标准）。
shisan66,生鲜水果,已关注,0,该用户想表达的含义是：我已经关注了直播间，对主播或商品产生了兴趣并希望持续了解。
shisan66,生鲜水果,点过了,0,该用户想表达的是自己已经按照主播的提示完成了点击关注或参与活动的操作。
shisan66,生鲜水果,已经关注了,0,该用户想表达的是对主播或商品的持续关注兴趣，暗示未来可能有购买意向。
shisan66,生鲜水果,早关注了,0,该用户想表达的含义是：自己已经是老粉丝了，对主播或产品有持续的关注和信任。
shisan66,生鲜水果,因为知识美美比你还早呢[龇牙][龇牙][龇牙][龇牙][龇牙][龇牙],0,该用户可能是在调侃或反驳主播提到的某个时间点，暗示“知识美美”（可能是另一位主播或品牌）更早就开始相关活动，带有自豪或戏谑的语气。
shisan66,生鲜水果,很喜欢美美.早就关注了,0,该用户想表达的是对主播美美的长期关注和喜爱，暗示对其推荐商品的潜在兴趣和信任。
shisan66,生鲜水果,什么时候带释焦,1,该用户想询问主播何时会推荐或展示释迦（水果）相关的商品。
shisan66,生鲜水果,@糖婷,0,该用户可能是想通过@主播“糖婷”来询问某个产品的具体信息或表达购买意向。
shisan66,生鲜水果,支持支持支持支持支持支持,0,该用户想通过重复的“支持”表达对主播或商品的积极认可和鼓励态度。
shisan66,生鲜水果,早点了,0,该用户想表达的是“我已经提前关注/下单了”。  （结合前文“已关注”“点过了”等类似弹幕的语境，用户可能在回应主播的引导性话术，强调自己已完成了关注或购买动作，隐含对直播间的支持或对商品的认可。）
shisan66,生鲜水果,来了来了,0,该用户想表达的含义是：准时进入直播间并表示对直播内容的关注和期待。
shisan66,生鲜水果,关注了,0,该用户想表达的是自己已经对主播或商品产生了兴趣并完成了关注行为，以此表明支持或期待后续内容。
shisan66,生鲜水果,就来了,0,该用户想表达的是自己刚刚进入直播间并开始参与互动。
shisan66,生鲜水果,喜欢你,0,该用户想表达对主播的喜爱和支持，可能是老粉丝在互动中表达情感。
shisan66,生鲜水果,你说了我立马点了,0,该用户想表达的是自己积极响应主播的号召或指令，已经迅速完成了某个互动动作（如点击关注、参与活动等）。
shisan66,生鲜水果,送给我[龇牙],0,该用户想表达的含义是：希望主播能将商品作为赠品送给自己。  （结合前文弹幕的互动氛围，用户可能在调侃或半开玩笑地表达对商品的兴趣，同时用表情符号缓和语气，显得轻松随意。）
shisan66,生鲜水果,点了点了点了点了点了,0,该用户想表达的含义是：已经按照主播的要求完成了点赞或关注操作。
shisan66,生鲜水果,喜欢十三,0,该用户想表达对主播或产品“十三”的喜爱和支持，可能是对主播昵称或商品代号的积极反馈。
